0, stage, overall, question, trial, answer
1, local, network, recently, comprehensive, gma
2, race, mile, springs, elliott, dale
3, phase, expect, gap, completion, pratt
4, colonial, indigenous, peru, conquest, accompany
5, greater, voivodeship, lesser, łódź, welch
6, coast, coastal, continental, designate, inland
7, introduce, diet, secular, rasmussen, smallpox
8, thousand, friendship, olive, nationalism, pony
9, hip, hop, rap, rapper, mixtape
10, tank, german, nazi, hitler, resistance
11, williams, maria, venus, monica, helena
12, stronger, clarkson, olson, fig, natal
13, peace, riot, assassination, condemn, urge
14, forest, species, habitat, marsh, shakespeare
15, annual, nichols, domino, year, clover
16, big, austin, jerry, cartoon, randy
17, birmingham, cabin, midland, archer, coventry
18, guy, nathan, fortune, hannah, morse
19, reef, artificial, barrier, coral, elm
20, throw, mills, marx, spear, javelin
21, isbn, paris, les, des, jean
22, islamic, palestine, destruction, iraq, baghdad
23, regard, rather, would, write, indeed
24, phd, caste, mali, senegal, postgraduate
25, europe, raid, viva, turkic, kazan
26, trust, trustee, nhs, rana, katrina
27, pakistan, khan, ali, shah, punjab
28, background, adelaide, safe, contestant, eliminate
29, dedicate, altar, baroque, feast, pilgrim
30, early, important, era, tradition, many
31, radio, broadcast, broadcasting, evening, broadcaster
32, electronic, dna, synthesizer, genome, funk
33, louisiana, penn, rochester, burton, monroe
34, notes, greene, georgetown, fuji, impression
35, pennsylvania, philadelphia, kennedy, franklin, marshall
36, romanian, romania, bucharest, basil, sparrow
37, future, save, ability, claire, noah
38, stable, chuck, ernest, gore, vanderbilt
39, boy, youth, scout, lodge, tata
40, function, alpha, filter, signal, phi
41, word, speak, meaning, dictionary, phrase
42, helen, worst, piper, maid, kara
43, free, cameron, dubai, emirates, essen
44, page, article, editor, edit, encyclopedia
45, cemetery, church, burial, nave, chapel
46, genus, walker, warren, butler, clarke
47, bulgarian, bulgaria, sofia, fuller, implant
48, still, form, today, completely, several
49, outside, expand, expansion, add, begin
50, temple, railway, junction, situate, kerala
51, british, majesty, associated, dove, bragg
52, campbell, stewart, stuart, fields, laurie
53, pirate, pursue, caesar, jasmine, dio
54, frac, mathbf, equation, partial, matrix
55, lake, pond, soil, lakes, ecosystem
56, title, champion, lose, defeat, las
57, beach, wave, surf, rip, mummy
58, hard, davis, double, clay, tennis
59, studio, disney, stop, segment, journey
60, venice, naples, sicily, venetian, verona
61, cox, mit, wesley, sloan, stony
62, sarah, terry, sketch, barker, python
63, studios, interactive, atari, rutherford, amos
64, iii, barry, lutheran, otto, maurice
65, factor, difference, compare, increase, decrease
66, contact, panel, pin, connector, barbados
67, bay, falls, heights, tampa, dominican
68, blues, recording, folk, tribute, record
69, retrieve, shelter, homeless, linden, sleeper
70, hunter, nancy, harlem, amtrak, lauderdale
71, mark, preston, mick, christine, buckingham
72, format, clear, switch, dover, flip
73, police, department, federal, officer, enforcement
74, craig, rob, bark, eucalyptus, macgregor
75, jack, brian, matt, eddie, tommy
76, player, match, game, draw, win
77, route, highway, road, connect, transportation
78, entry, vancouver, kings, duck, lightning
79, minnesota, lewis, prior, madison, minneapolis
80, americans, immigrant, refugee, immigration, veteran
81, hold, promote, organize, invite, encourage
82, fish, elvis, presley, freshwater, alta
83, grace, moody, bella, avery, larkin
84, harper, cambodia, rouge, khmer, stokes
85, virginia, pitt, chesapeake, roanoke, jacobson
86, benjamin, roosevelt, theodore, dwight, lowell
87, burning, offering, forensic, hector, laurent
88, house, window, arch, gable, storey
89, limited, physical, weekly, certification, bag
90, die, spend, death, life, later
91, chicago, illinois, bloom, opus, dei
92, nation, pen, cherokee, removal, currie
93, market, stock, insurance, cash, investor
94, property, interest, owner, pay, debt
95, columbia, lawrence, jay, parade, parody
96, director, krishna, shankar, remake, vijay
97, arizona, morgan, shoot, sheriff, shooting
98, county, kentucky, metropolitan, bureau, statistics
99, ancient, archaeological, bce, epic, archaeology
100, tower, complex, entrance, underground, locate
101, cold, rain, trace, mid, geological
102, concept, knowledge, enterprise, formal, entity
103, fight, decision, loss, mixed, martial
104, sam, warner, bug, drew, tune
105, san, francisco, nebraska, davenport, byrd
106, guinea, chandler, papua, atoll, png
107, towards, pradesh, andhra, rand, sol
108, common, acid, owl, ecology, amino
109, prepare, preparation, gully, iqbal, also
110, boston, massachusetts, vermont, friends, joshua
111, star, planet, cloud, galaxy, cluster
112, need, successful, addition, throughout, many
113, van, painting, paint, portrait, painter
114, horse, dog, russell, breed, wolf
115, prisoner, escape, incident, execute, execution
116, fame, hall, induct, lou, fritz
117, view, debate, argue, discuss, discussion
118, engine, valve, rpm, cylinder, civic
119, source, classical, attribute, randolph, depiction
120, font, wakefield, freddy, cullen, typeface
121, suffer, treat, nurse, cure, illness
122, marc, donna, tina, olivia, jill
123, television, fox, channel, abc, cbs
124, try, jake, meredith, cassie, wilkins
125, sydney, newcastle, wales, nsw, gerald
126, lay, trinity, episcopal, canon, anglican
127, alabama, morris, ncaa, sec, rivalry
128, james, beverly, pamela, quentin, yvonne
129, marina, elena, boris, olga, yuri
130, paso, sure, papa, candle, wilder
131, pole, vault, elias, willoughby, asturias
132, education, higher, educational, subject, examination
133, father, brother, son, younger, mother
134, fair, farmer, palm, hectare, powder
135, london, cardiff, pueblo, stella, edison
136, bin, ellen, mohammed, qatar, abdullah
137, jan, mar, leonard, dec, jun
138, roman, rome, hamlet, julia, romans
139, production, produce, factory, manufacturing, assemble
140, week, keep, ready, aquarium, blizzard
141, tax, fund, firm, trading, income
142, carey, kramer, elaine, myspace, embark
143, contract, manager, transfer, loan, sign
144, release, records, label, dvd, compilation
145, rule, dynasty, ruler, invasion, coup
146, oil, deposit, petroleum, sandstone, well
147, ronald, reagan, anand, barrister, daphne
148, anne, gilbert, sullivan, blake, richardson
149, space, launch, rocket, satellite, nasa
150, top, record, hit, hot, billboard
151, saint, virgin, caribbean, jamaica, patron
152, alien, leo, zero, spark, syndicate
153, winter, snow, giant, resort, ski
154, hope, michelle, kwan, osborn, kam
155, marvel, phoenix, emma, fictional, avengers
156, career, regular, goal, assist, franchise
157, july, january, carlisle, midwest, june
158, independence, protest, activist, declare, abortion
159, digital, entertainment, sale, download, hello
160, additional, brick, wars, ira, trilogy
161, republic, congo, tanzania, rwanda, hume
162, pair, catch, ink, goodman, mature
163, people, birth, decline, much, almost
164, music, jazz, artist, musician, popular
165, south, africa, african, macmillan, johannesburg
166, greg, cole, derek, ricky, anita
167, surface, pressure, temperature, liquid, fluid
168, politics, feminist, influential, miranda, feminism
169, crash, landing, plane, approach, swift
170, john, andrews, fairfield, new, fordham
171, sell, santo, dairy, domingo, foods
172, auction, cbc, buyer, seller, parry
173, chester, fountain, milton, cheshire, dartmouth
174, industries, hansen, killing, chartered, hyundai
175, burn, kitchen, seymour, folklore, asteroid
176, england, hampshire, southampton, portsmouth, winchester
177, apple, dialogue, thirty, virtue, plato
178, west, richmond, sheffield, somerset, devon
179, district, village, rural, settlement, municipal
180, singapore, malaysia, indonesia, indonesian, sultan
181, associate, many, frequently, particularly, burden
182, wrong, gilmore, rory, mist, homecoming
183, vietnam, vietnamese, citadel, nam, minh
184, state, majority, seek, favor, pierce
185, organism, fungus, parasite, reproduction, spore
186, member, association, committee, chairman, board
187, inspire, wish, everything, bruno, beyoncé
188, become, year, time, first, later
189, access, primary, secondary, kenya, kenyan
190, spanish, spain, madrid, cruz, luna
191, material, plastic, antarctic, strength, fiber
192, baltic, latvia, latvian, riga, dodd
193, government, capital, relief, pleasant, administration
194, nuclear, accident, missile, weapon, viaduct
195, trek, collective, desmond, voyager, mitch
196, brief, laws, prestigious, lichen, azad
197, miller, hicks, listener, hitchcock, mosley
198, type, lot, poster, copeland, obsolete
199, edition, pack, backup, messenger, latest
200, site, wales, welsh, mound, putnam
201, commercial, advertising, smoke, advertisement, stevenson
202, griffin, nottingham, basque, apache, bert
203, gain, attention, watt, amplifier, distortion
204, attempt, ultimately, blow, prove, mistake
205, taiwan, lighthouse, nationalist, taipei, mainland
206, young, utah, banner, mormon, regency
207, korea, korean, seoul, zürich, koreans
208, person, mean, verb, refer, past
209, energy, current, heat, circuit, tube
210, league, season, team, play, game
211, division, reserve, premier, bristol, rangers
212, territory, plantation, treasure, vii, viii
213, minister, ministry, prime, cabinet, shadow
214, phillips, chelsea, brett, beard, scarborough
215, jim, uncle, puppet, tragedy, hayden
216, chemical, reaction, compound, organic, oxygen
217, condition, weather, forecast, spence, meteorological
218, rise, ceremony, tea, johnston, taste
219, joan, miles, burns, robertson, lynn
220, montana, billing, viper, yellowstone, glorious
221, daisy, walters, debbie, sardinia, rollins
222, del, lab, con, que, amor
223, period, pottery, style, ceramic, decoration
224, information, analysis, assessment, evaluation, approach
225, remain, later, survive, earlier, early
226, metal, heavy, snake, sonic, chaos
227, would, million, announce, due, confirm
228, lecture, princeton, lifetime, hollow, mckenna
229, repair, incorporate, essential, webster, probe
230, chapter, soul, mind, reality, ritual
231, campaign, abbott, lobby, romney, brandenburg
232, scholar, brooke, hoffman, resurrection, doi
233, journal, foundation, focus, contribution, publication
234, lee, kim, drama, excellence, jung
235, program, degree, management, offer, certificate
236, kansas, missouri, miami, baltimore, louis
237, park, ride, attraction, roller, coaster
238, mike, bell, bedford, excerpt, bells
239, tour, cut, classic, stroke, masters
240, finnish, finland, helsinki, silesian, silesia
241, development, resource, planning, develop, seminar
242, nina, jerome, stein, savannah, burt
243, home, visit, numerous, know, several
244, animation, suit, anime, kit, manga
245, competition, pro, columbus, competitor, kyle
246, join, squad, amsterdam, den, defender
247, agriculture, extension, welfare, agricultural, veterinary
248, archive, archives, advise, devote, document
249, organisation, minority, declaration, recognise, bison
250, team, cup, profile, basketball, champions
251, song, pop, soundtrack, music, grammy
252, york, new, hamilton, philip, hudson
253, northern, ireland, patrick, belfast, ulster
254, michael, sue, janet, timothy, perkins
255, carbon, emission, climate, energy, renewable
256, burke, diana, apollo, holly, levi
257, former, notable, formerly, cottage, current
258, western, province, provincial, perth, fremantle
259, stand, venue, oslo, attendance, eva
260, occupation, fortress, duchy, prussia, prussian
261, parish, hundred, petersburg, manor, vladimir
262, international, participate, participation, hyde, world
263, douglas, lynch, boeing, shannon, charlton
264, china, chinese, beijing, shanghai, qing
265, san, puerto, rico, juan, costa
266, yale, limestone, sara, guildford, hickman
267, track, vocal, guitar, album, keyboard
268, modern, ming, cyrus, supermarket, loyalty
269, date, medieval, restoration, gothic, restore
270, sport, sports, sponsor, cycling, baldwin
271, rock, dead, session, alive, zombie
272, lock, susquehanna, masonic, mcgrath, berwick
273, hull, ellis, lincolnshire, grimsby, becky
274, spencer, bee, geelong, vfl, afl
275, chair, furniture, bergen, ada, rockefeller
276, queen, golden, albert, victor, coronation
277, september, august, october, panama, may
278, buy, longer, horton, raft, calculator
279, raw, wwe, tin, survivor, feud
280, key, table, signature, poison, collision
281, science, isaac, hugo, asimov, analog
282, lighting, flame, solidarity, shrimp, cleaning
283, export, import, ton, corn, industry
284, fred, jenkins, farrell, peacock, hahn
285, wrestling, tag, championship, match, wrestler
286, fall, iron, recover, fragment, kirk
287, fire, gun, target, radar, syracuse
288, german, germany, munich, hamburg, frankfurt
289, none, solid, knock, garcia, boxer
290, plan, facility, approve, open, include
291, mother, sister, parent, life, sibling
292, crime, victim, violence, criminal, abuse
293, grand, prix, ret, ger, fra
294, camp, enter, pier, concentration, futsal
295, seven, one, two, three, sevens
296, governor, kosovo, tulsa, assyrian, lieutenant
297, rifle, rubber, barrel, gun, lamp
298, norwegian, doll, ole, axe, hodge
299, animal, nature, wild, wildlife, sanctuary
300, philippines, philippine, manila, filipino, jose
301, principal, warwick, bacon, marks, bedroom
302, arm, rose, crown, eagle, lion
303, global, economic, tourism, forum, initiative
304, remix, mix, feat, mafia, groove
305, employee, benefit, increase, minimum, employer
306, telegraph, invention, demonstrate, invent, demonstration
307, centre, springfield, shopping, ronnie, redevelopment
308, wellington, circus, sinclair, centennial, locke
309, trailer, ribbon, rope, gates, tension
310, boss, mario, sergio, milano, simone
311, tree, pine, darwin, trunk, forestry
312, overseas, peoples, pullman, antelope, bautista
313, country, establish, establishment, across, number
314, attack, kill, soldier, enemy, destroy
315, roberts, chapman, mathis, courtroom, mccabe
316, florence, della, bologna, lorenzo, fresco
317, prize, casino, payne, gaming, connor
318, price, cost, rate, value, demand
319, guest, stay, mama, fry, mom
320, back, pete, aaron, josh, hank
321, scott, hollywood, cast, collins, min
322, ralph, abu, separation, uae, marin
323, slave, prison, slavery, beaver, punishment
324, danger, warning, warn, alert, macarthur
325, paradise, waterloo, brock, sharpe, trooper
326, marathi, calvin, cascade, chalk, defunct
327, struggle, radical, anarchist, guyana, ambrose
328, christian, doctrine, fellowship, congregation, witness
329, place, name, oldest, take, commemorate
330, pope, cathedral, holy, cardinal, church
331, conservation, desert, egg, turtle, cecil
332, revolution, historian, revolutionary, exile, peasant
333, party, communist, socialist, alliance, coalition
334, hair, negro, aaa, mini, libre
335, child, pray, mushroom, hepburn, mantis
336, action, task, aim, creation, participant
337, far, extend, entire, peninsula, stretch
338, poland, vera, lublin, esther, auschwitz
339, italian, italy, milan, serie, roma
340, health, care, adult, prevention, juvenile
341, safety, patent, services, rescue, emergency
342, ever, behind, success, greatest, touch
343, ltd, highland, sons, highlands, headmaster
344, christmas, holiday, youtube, jam, claus
345, direction, noise, medium, vertical, use
346, female, male, sex, sexual, oral
347, win, championship, victory, trophy, palmer
348, link, experiment, discovery, collaboration, experimental
349, electron, atom, energy, mineral, fusion
350, system, transport, deliver, delivery, use
351, location, restaurant, chain, fast, chef
352, northwest, alaska, arctic, newfoundland, woodland
353, challenge, nevada, memphis, nolan, nate
354, power, load, rod, dorothy, shaft
355, joe, dan, kid, joey, byrne
356, southern, legacy, zimbabwe, mozambique, rhodesia
357, net, shark, fin, sharks, watford
358, serbian, serbia, croatian, croatia, yugoslavia
359, turn, inside, pull, push, trap
360, idol, jain, jeffrey, vow, dominic
361, money, coin, dollar, cent, mint
362, california, los, angeles, santa, barbara
363, concert, leg, arena, tel, aviv
364, espn, norwich, terrorism, analyst, commentator
365, gulf, cornwall, kuwait, cornish, donaldson
366, davies, anton, bolton, gymnasium, roth
367, official, officially, previously, suspend, regularly
368, show, live, talk, talent, highlight
369, goal, cup, goals, total, apps
370, region, eastern, ethnic, pittsburgh, basin
371, battle, capture, captain, force, fight
372, love, musical, lover, julie, kay
373, comic, novel, adventure, jane, comics
374, julian, curry, atkinson, gunn, naomi
375, celebrity, bennett, reynolds, joke, hilton
376, history, morales, tudor, surprise, kinder
377, summer, meter, pool, swimming, pan
378, sim, sims, delete, suriname, ctv
379, right, leave, hand, left, equal
380, say, review, critic, comment, critical
381, act, comedy, jacques, andré, henri
382, giovanni, monte, carlo, andrea, expressway
383, moral, intellectual, disability, solomon, ethical
384, air, jet, spray, thrust, fog
385, large, structure, growth, barrett, grow
386, around, lower, upper, mostly, part
387, though, whose, even, decade, figure
388, native, oklahoma, mississippi, indians, settler
389, horn, vista, saddle, rhino, buena
390, brook, durham, watts, kimball, vulcan
391, water, supply, salt, tender, drinking
392, household, age, census, median, income
393, last, another, macdonald, absence, next
394, receive, earn, would, hire, later
395, napoleon, slovenia, slovenian, ljubljana, doris
396, episode, appear, television, series, season
397, mail, blog, fraud, email, reputation
398, anthony, lucky, jewel, gardiner, homo
399, group, found, since, currently, basel
400, disc, flash, purple, bright, iris
401, guide, ruth, regina, karen, gloria
402, final, finish, third, second, team
403, bury, probably, marcus, colleague, consul
404, wilson, abbey, abbot, suffrage, jasper
405, field, honor, tech, athletic, varsity
406, avenue, along, portion, plaza, boulevard
407, present, bring, cheyenne, aside, kaya
408, four, three, five, six, two
409, reach, expedition, summit, climb, explorer
410, issue, post, stamp, collect, sheet
411, bear, footballer, surname, politician, disambiguation
412, football, senior, junior, murphy, centenary
413, real, bhutan, hesse, maze, bilbao
414, yard, nfl, game, touchdown, rush
415, united, states, serve, law, receive
416, bible, reading, testament, biblical, revise
417, carr, mongolia, lauren, mongolian, banda
418, cat, formula, race, ret, spa
419, video, version, single, release, mtv
420, measure, object, ratio, measurement, constant
421, spread, span, longest, outbreak, adjacent
422, jump, athletics, barcelona, triple, brady
423, republican, democratic, convention, labor, federation
424, boat, eight, men, crew, rowing
425, steel, arc, madonna, forge, weld
426, american, america, cornell, businessman, willis
427, islands, gang, mexican, cartel, vargas
428, ken, driver, speedway, race, nascar
429, disaster, earthquake, uganda, kenneth, mackenzie
430, bank, share, credit, financial, exchange
431, pacific, retirement, competitive, samoa, appliance
432, play, score, make, debut, twice
433, provide, activity, poor, scheme, improve
434, read, allan, anthropology, cache, poe
435, service, operate, passenger, crane, lines
436, wealthy, know, conspiracy, cicero, draper
437, christopher, itv, belarusian, elf, tolkien
438, colombia, pablo, colombian, carmen, rodriguez
439, break, discover, tape, setting, dust
440, man, electric, isle, eddy, ramsey
441, disease, prevent, effective, recommend, recovery
442, report, zone, urban, inhabitant, kilometer
443, point, maxwell, brennan, daly, butt
444, status, reform, adopt, shall, custom
445, mountain, valley, range, glacier, plain
446, russian, soviet, russia, moscow, ivan
447, control, machine, equipment, use, scenario
448, tobacco, warehouse, compass, maize, navigator
449, march, april, june, november, december
450, national, list, historic, register, places
451, ice, hockey, arena, team, hawks
452, romance, lena, whatever, bianca, tanaka
453, tibetan, tibet, orchid, lama, bulbophyllum
454, get, kiss, happy, let, cry
455, der, von, berlin, und, karl
456, organ, donate, donation, amanda, donor
457, tribe, settle, descendant, tribal, inhabit
458, aircraft, fighter, bomber, flight, aviation
459, economy, economic, policy, political, means
460, recognize, massacre, gregory, holocaust, genocide
461, express, mass, daily, matter, counter
462, writer, laura, autobiography, frances, novelist
463, climate, tropical, cyclone, hurricane, storm
464, sun, watch, heaven, autumn, lin
465, wear, fashion, dress, cotton, uniform
466, design, door, remove, timber, slide
467, irish, dublin, ireland, cork, munster
468, hastings, alma, sunny, mater, soy
469, israel, israeli, strip, palestinian, gaza
470, cuba, cuban, castro, clara, sutton
471, like, look, always, enjoy, weir
472, master, rating, chess, pace, correspondence
473, sign, howard, children, hearing, deaf
474, game, player, diamond, playstation, release
475, dam, reservoir, flood, irrigation, hydroelectric
476, hardy, wheeler, wheelchair, paralympics, paralympic
477, ryan, kelly, kevin, ian, pat
478, sea, ocean, shell, classification, snail
479, smith, species, marine, adams, watson
480, cell, protein, virus, bacterium, receptor
481, roll, sacramento, mona, dice, liar
482, white, red, green, blue, block
483, triumph, autonomy, galicia, anchorage, iberian
484, conflict, chad, humanitarian, cheap, straw
485, involve, arrange, involvement, policeman, ransom
486, good, come, never, away, beautiful
487, often, usually, traditional, generally, may
488, ferguson, canberra, jensen, squash, punta
489, attend, raise, harvard, charity, charitable
490, bbc, mitchell, presenter, programme, breakfast
491, club, stadium, greek, greece, athens
492, teacher, learn, learning, parent, lesson
493, diary, torture, detention, bahrain, captive
494, small, rename, although, huge, know
495, spirit, detroit, gibson, clerk, oath
496, town, land, near, nearby, area
497, community, resident, housing, area, local
498, paul, norton, leicester, reunion, halloween
499, select, database, dunn, oracle, query
500, martin, position, platinum, villa, aria
501, partner, joint, injury, bone, tear
502, work, job, opportunity, employment, unemployment
503, gordon, bruce, wayne, robin, batman
504, wing, fly, wind, pilot, lift
505, suggest, evidence, origin, indicate, might
506, bangladesh, mosque, cricket, literacy, cricketer
507, commitment, dominion, associates, pamphlet, loving
508, girl, boys, tiger, girls, leopard
509, mary, lady, chapel, brothers, brother
510, copper, brass, bart, concentrate, potassium
511, organization, support, help, effort, volunteer
512, wheel, manufacturer, manufacture, gear, brake
513, print, picture, photograph, photo, photography
514, tom, desire, childhood, rainbow, assassin
515, nba, basketball, game, pick, rebound
516, jason, rogers, stars, outstanding, doug
517, morton, andersen, grange, cassidy, shaun
518, survey, sky, observation, observatory, telescope
519, famous, among, prominent, unique, amongst
520, reveal, evil, superman, wonder, villain
521, various, knife, reggae, showcase, lantern
522, black, color, legend, turner, width
523, indian, india, singh, mumbai, ram
524, jackson, chris, steve, bob, tony
525, volume, magic, devil, hell, witch
526, line, train, railway, dean, gauge
527, process, quality, tool, application, storage
528, software, user, web, windows, microsoft
529, computer, memory, core, clock, ibm
530, castle, duke, elizabeth, frederick, margaret
531, model, engine, vehicle, speed, hybrid
532, section, tier, relegate, div, cobra
533, company, product, customer, brand, marketing
534, liverpool, yorkshire, leeds, whilst, huddersfield
535, charge, arrest, sentence, trial, accuse
536, berry, camden, illustrated, harriet, torch
537, trip, rhodes, nicaragua, lawson, malawi
538, president, stanford, herbert, czechoslovakia, uzbekistan
539, figure, shrine, skating, skate, continent
540, must, purpose, actual, liability, intend
541, river, bucurești, apelor, rivers, tributary
542, college, student, campus, graduate, academic
543, develop, max, helicopter, conventional, aerial
544, tim, graham, nash, eden, valentine
545, robinson, awareness, aids, hiv, miracle
546, natural, gas, resources, pipeline, handbook
547, jefferson, coffin, staffordshire, ponce, foundry
548, walk, twin, dangerous, fourteen, zimmerman
549, call, end, occasion, also, one
550, introduction, writings, commentary, ethic, thought
551, producer, sound, engineer, audio, executive
552, strike, iraq, syria, syrian, rebel
553, trail, recreation, parks, cove, rapids
554, ibn, muhammad, islam, prophet, islamic
555, license, permit, amendment, carry, restriction
556, character, instead, previous, arrow, unlike
557, mercer, fulton, comfort, purdue, tiffany
558, research, scientific, laboratory, abstract, work
559, danish, austria, denmark, austrian, copenhagen
560, regional, salvador, rey, goat, fool
561, public, office, board, building, superintendent
562, georgia, grammar, georgian, comparative, discourse
563, saudi, arabia, yemen, arabian, mckay
564, clark, lois, het, canary, tsr
565, nigeria, sierra, nigerian, leone, lagos
566, datum, client, protocol, multiple, server
567, tamil, telugu, rao, kannada, nadu
568, meet, soon, across, finally, mrs
569, pass, maintain, conduct, responsibility, instructor
570, earth, motion, observer, orbit, solar
571, hungarian, hungary, keith, duncan, budapest
572, miguel, lithuania, lithuanian, jonas, vilnius
573, peter, parker, norman, aunt, amazing
