574, write, biography, raymond, work, compile
575, twenty, beacon, wills, shamrock, fai
576, gay, connecticut, lesbian, lgbt, pride
577, burma, myanmar, burmese, damascus, emir
578, letter, latin, script, symbol, write
579, henry, daniel, berkeley, holt, viking
580, fail, result, already, allow, despite
581, reason, whether, person, concern, certain
582, larry, taxi, jaguar, cyber, outfit
583, award, best, nominate, year, nomination
584, band, split, punk, member, drummer
585, bond, potential, mechanism, molecule, synthesis
586, damage, delaware, cedar, tornado, severe
587, note, worth, currency, reverse, pound
588, area, located, scale, part, descend
589, research, scientist, psychology, researcher, biology
590, hawaii, hawaiian, jennings, honolulu, kris
591, wood, evolution, evolve, diversity, evolutionary
592, feature, bad, welcome, dogg, tha
593, family, age, older, live, aged
594, eleven, hidden, stirling, leisure, forth
595, store, close, mall, retail, open
596, body, weight, sugar, fat, lifestyle
597, state, iowa, peterson, ames, moines
598, emperor, wang, liu, han, zhang
599, atlanta, walton, norris, marta, relocation
600, active, convert, enzyme, logistics, phosphate
601, distribution, delta, variable, hat, normal
602, moon, full, plymouth, diameter, wagon
603, singer, sing, lyric, compose, chorus
604, movement, practice, teach, exercise, occupy
605, alexandra, crewe, cher, bono, margarita
606, project, complete, sunset, work, ceremonial
607, simon, storm, canyon, shirley, dino
608, standard, option, install, upgrade, transmission
609, stephen, sophie, matilda, mortimer, tick
610, put, shot, morrison, mauritius, beaumont
611, rhode, providence, governors, island, zanzibar
612, miss, winner, stake, derby, beauty
613, soccer, henderson, mls, streak, team
614, meeting, mercy, brent, secretariat, meet
615, per, average, percent, every, poverty
616, language, speaker, dialect, vowel, speak
617, arthur, cave, passage, explore, merlin
618, jewish, jews, rabbi, hebrew, jerusalem
619, card, deck, dealer, pledge, muse
620, war, order, military, world, alliance
621, constitution, jurisdiction, constitutional, law, act
622, affair, whitney, pregnant, zoe, gillespie
623, warrior, foster, fear, encounter, hammer
624, sample, particle, magnetic, radiation, spectrum
625, amount, temperature, grain, soil, yield
626, ask, say, refuse, would, fact
627, central, sri, lanka, colombo, lankan
628, direct, premiere, adapt, adaptation, directed
629, fort, india, palace, delhi, tomb
630, identify, presence, isolate, identification, moldova
631, king, kingdom, mention, reign, inscription
632, album, release, guitar, bass, record
633, understand, context, approach, aspect, define
634, egypt, orthodox, egyptian, calendar, alexandria
635, systems, venture, cease, aero, subsidy
636, jones, richards, blair, mann, bernstein
637, civil, oliver, educate, cromwell, royalist
638, detective, mystery, productions, holmes, inspector
639, european, metre, personal, indoor, chase
640, file, road, image, jpg, cross
641, arnold, buck, dixon, roche, npc
642, haiti, gloucester, bowen, creole, haitian
643, count, swing, oscar, benny, freddie
644, royal, mount, honour, essex, suffolk
645, amazon, feather, hanover, parrot, predominantly
646, alberta, saskatchewan, edmonton, calgary, dwelling
647, anniversary, carroll, sharon, maggie, crush
648, art, artist, gallery, exhibition, work
649, broadway, musical, comedy, lucas, justin
650, little, tale, fairy, pike, higgins
651, architecture, heritage, architect, architectural, building
652, ten, rally, sony, colin, biggest
653, hotel, brooklyn, brunswick, brighton, atlas
654, policy, finance, corporate, financial, budget
655, opening, defense, defence, chance, defend
656, monastery, monk, buddhist, dame, buddhism
657, succeed, quarter, hugh, cyprus, sovereign
658, business, corporation, ceo, clinton, executive
659, charlie, silent, chaplin, severn, millionaire
660, realm, mortal, skinner, kung, rumor
661, grant, goldsmith, pont, ulysses, huber
662, city, ferry, headquarters, relocate, reopen
663, cancer, breast, tumor, lung, survival
664, medal, championships, games, olympic, olympics
665, describe, relationship, feeling, trans, genesis
666, coach, head, conference, assistant, coaching
667, institution, prison, inmate, berg, correction
668, auckland, remember, forget, christchurch, connolly
669, hindi, alongside, dub, hai, kapoor
670, swedish, sweden, carl, stockholm, erik
671, center, align, left, bgcolor, style
672, bus, metro, transit, ukrainian, ukraine
673, effect, negative, possible, difficult, bias
674, security, strategy, manage, responsible, management
675, problem, edge, cycle, path, algorithm
676, cricket, match, jimmy, wicket, bowling
677, brazil, brazilian, rio, grande, rosa
678, environmental, environment, protection, waste, pollution
679, old, myth, saga, mythology, norse
680, scotland, scottish, edinburgh, westminster, angus
681, william, thomas, robert, charles, richard
682, thompson, belgium, belgian, cincinnati, brussels
683, belle, librarian, geoff, thirteen, protectorate
684, response, infant, tract, antibody, guidance
685, george, politician, armstrong, ashley, vernon
686, army, regiment, battalion, infantry, brigade
687, opera, teatro, soprano, libretto, dramatic
688, reference, lisa, homer, simpsons, ashton
689, additionally, angela, somalia, somali, summon
690, independent, sabha, constituency, lok, libya
691, rick, sudan, eugene, ranger, nile
692, package, testing, container, dynamic, stack
693, god, religious, religion, faith, prayer
694, navy, naval, fleet, admiral, captain
695, faculty, sciences, department, university, cameroon
696, railroad, class, rail, locomotive, railway
697, day, month, prescott, year, time
698, times, cooper, guild, annie, writers
699, cause, skin, disease, pain, syndrome
700, together, crosby, plague, jeanne, bing
701, food, crop, farming, sole, nicholson
702, hong, kong, ban, blind, chan
703, deal, donald, bid, trump, trick
704, indiana, indianapolis, dump, evansville, terre
705, change, entropy, sap, cowan, laundry
706, cape, são, paulo, verde, plc
707, guatemala, mack, chatham, bald, mabel
708, largest, approximately, capacity, million, total
709, hospital, bed, gmina, ethan, barnett
710, wright, hughes, hearts, barton, nobody
711, neighborhood, hills, grove, manhattan, queens
712, dance, ball, ballet, dancer, dancing
713, appearance, nick, make, twitter, appear
714, alexander, jordan, edwards, mason, fisher
715, frame, plus, expert, pipe, bicycle
716, museum, collection, display, exhibit, powers
717, private, partnership, revenue, fee, regulation
718, tennessee, suicide, nashville, riverside, schneider
719, treaty, border, negotiation, gibraltar, sovereignty
720, iceland, rover, nordic, gale, olsen
721, zealand, new, trinidad, carnival, māori
722, rachel, jennifer, jessica, beth, nicole
723, beer, drink, brand, porter, milwaukee
724, slovakia, slovak, bowie, practitioner, gong
725, side, wall, square, circle, interior
726, election, elect, parliament, assembly, seat
727, bishop, catholic, diocese, priest, archbishop
728, frog, stan, icelandic, kerr, pune
729, school, high, grade, elementary, student
730, harry, dennis, badge, yacht, sailing
731, chief, officer, constable, weston, ensue
732, believe, upon, inform, proceed, would
733, special, popularity, mbc, cameo, sbs
734, tournament, open, golf, dnp, professional
735, harvey, sherman, northwestern, vase, browning
736, media, staff, programme, founder, executive
737, washington, williamson, spokane, covered, amherst
738, basic, level, index, district, pennsylvania
739, eventually, arrive, rest, search, hide
740, obtain, request, aid, subsequently, require
741, series, eric, alex, adrian, lowe
742, arab, muslim, arabic, muslims, arabs
743, face, crystal, shape, angle, triangle
744, czech, prague, franz, josef, hunger
745, event, attract, celebration, midnight, annually
746, dutch, netherlands, dental, geography, outline
747, bird, bush, reed, kurt, birds
748, mental, sleep, disorder, behavior, personality
749, doctor, companion, eighth, ninth, tenth
750, colony, gate, layout, nagar, colonist
751, foot, flat, hose, gorman, tandem
752, channel, internet, mobile, cable, communication
753, law, rights, legal, human, registration
754, spiritual, initiate, disciple, swami, meditation
755, officer, rank, guard, medal, commander
756, social, influence, emerge, widely, reflect
757, within, divide, boundary, estimate, recent
758, training, course, class, skill, cadet
759, chart, singles, peak, album, single
760, colorado, denver, bailey, downtown, subway
761, bath, wet, darren, serra, therapist
762, court, case, supreme, appeal, judge
763, oak, dry, milk, soft, cheese
764, norway, mouth, amy, strait, diane
765, argentina, josé, chile, luis, argentine
766, drug, illegal, possession, substance, use
767, australia, australian, australians, honours, obe
768, return, britain, following, shortly, year
769, poem, poetry, poet, taylor, samuel
770, car, drive, ford, motor, truck
771, technique, use, judo, tattoo, brace
772, sculpture, monument, depict, marble, sculptor
773, hall, build, estate, residence, building
774, garden, gardens, grounds, botanical, orphan
775, medical, medicine, patient, treatment, care
776, accord, consider, accept, cite, reject
777, gene, modify, rna, modification, transcription
778, bill, buffalo, pirates, calgary, maguire
779, agent, carter, fbi, nielsen, boone
780, magazine, cover, publishing, copy, publisher
781, academy, professor, fellow, chemistry, gem
782, construction, construct, industrial, works, concrete
783, general, justice, judge, attorney, supreme
784, airport, terminal, destination, handle, hub
785, church, baptist, missionary, methodist, seminary
786, prince, imperial, emperor, rebellion, throne
787, baseball, major, anderson, yes, pitch
788, find, human, could, expose, examine
789, brain, muscle, neuron, receptor, nerve
790, lawyer, convict, scandal, behalf, patriot
791, way, able, experience, unable, cain
792, diego, jonathan, venezuela, san, lucy
793, farm, barn, homestead, willy, blanche
794, society, vol, sociology, thesis, scholarly
795, harris, reid, malcolm, christie, clown
796, african, detail, nations, africa, morocco
797, quebec, montreal, canada, mayo, aberdeen
798, lincoln, lloyd, abraham, omaha, fowler
799, building, room, floor, historic, contribute
800, armenian, azerbaijan, armenia, cohen, baku
801, host, affiliate, cyril, coke, bartholomew
802, plant, grow, flower, leaf, seed
803, caroline, barber, dune, isabel, alison
804, reactor, nuclear, uranium, shut, radioactive
805, institute, technology, engineering, technical, electronics
806, perform, performance, audience, performer, stunt
807, historical, newspaper, obituary, boyer, telegram
808, ship, vessel, sail, submarine, sink
809, mars, crater, impact, volcano, dome
810, marie, ottawa, louise, erie, niagara
811, film, movie, actor, cinema, screen
812, contain, document, initial, manuscript, commando
813, japan, japanese, tokyo, clan, prefecture
814, brooks, schmidt, dig, det, manifesto
815, iran, iranian, regime, tehran, decree
816, workshop, lyon, nice, oriental, weaver
817, website, online, create, artwork, monthly
818, steven, lancaster, randall, affiliation, everton
819, texas, mexico, mexican, nicholas, webb
820, beck, vic, molly, milford, lansing
821, lord, earl, baron, son, commons
822, crow, liberia, swallow, doe, thistle
823, move, piece, knight, step, forward
824, fuel, falcon, leonardo, vega, belmont
825, street, corner, courthouse, building, streets
826, think, feel, thing, something, explain
827, selection, genetic, mutation, dominant, inherit
828, carrie, pulitzer, waller, lookout, poznań
829, variety, wine, grape, harvest, vineyard
830, foreign, appoint, secretary, relation, mission
831, economics, administration, bachelor, commerce, innovation
832, stone, statue, ruin, pillar, relic
833, hindu, celebrate, temple, guru, fiji
834, thailand, thai, bang, bangkok, barrow
835, purchase, acre, fraser, premise, accommodation
836, story, novel, author, short, fiction
837, light, camera, lens, laser, optical
838, orchestra, piano, composer, symphony, music
839, university, honorary, studies, scholarship, cooperative
840, operation, authority, domestic, maintenance, aviation
841, character, monster, animated, horror, creature
842, designer, graphic, virtual, disk, boot
843, allen, cleveland, orleans, balance, lacrosse
844, bridge, norfolk, rebuild, erect, alley
845, jon, mentor, garfield, maclean, ashford
846, oxford, cambridge, bradford, edwin, pearson
847, walter, jeff, obama, stevens, davidson
848, joseph, saints, latter, elder, twelve
849, station, platform, serve, suburban, toward
850, sand, cool, crab, occasionally, swap
851, freedom, speech, criticism, criticize, controversy
852, code, number, bit, operator, use
853, press, isbn, liberty, funeral, townsend
854, viewer, ted, creator, lily, storyline
855, hill, ridge, cliff, goa, hut
856, albanian, albania, macedonia, macedonian, kosovo
857, want, get, decide, meet, tell
858, english, publish, literature, translation, translate
859, interview, entitle, bonus, glenn, podcast
860, sit, reservation, gather, plains, sioux
861, role, actress, lead, actor, malayalam
862, claim, agree, resolution, dispute, resolve
863, highest, grave, honey, valencia, lowest
864, mine, mill, canal, coal, mining
865, perry, legion, dwarf, myers, jeremiah
866, napier, karlsruhe, ridley, hawke, beech
867, branch, heart, blood, deep, external
868, island, maya, lagoon, honduras, talbot
869, news, journalist, media, reporter, journalism
870, camel, stair, hangar, avalon, fillmore
871, investigation, commissioner, report, investigate, corruption
872, vote, election, candidate, liberal, conservative
873, alan, phil, andy, dylan, leigh
874, study, emotion, emotional, eds, gage
875, wyoming, estonian, estonia, tallinn, yiddish
876, french, france, louis, commune, pierre
877, moore, holland, marion, fletcher, vein
878, visitor, zoo, mesa, architects, enclosure
879, memorial, tribune, barracks, bingham, vickers
880, long, quinn, gazette, nassau, morley
881, mouse, carol, mickey, nephew, luck
882, copa, nickname, joel, atlético, campeonato
883, frank, kazakhstan, mackay, dirk, zappa
884, ross, bet, levy, marvin, lil
885, empire, ottoman, byzantine, persian, turkish
886, agency, intelligence, guardian, cia, spy
887, alice, judy, wonderland, dakar, mueller
888, swiss, sector, switzerland, apartment, belong
889, union, rugby, cap, orlando, rfc
890, eye, visual, vision, fracture, illusion
891, seal, whale, killer, ufo, dolphin
892, true, argument, truth, principle, logic
893, brown, dark, colour, spot, grey
894, corpus, wally, windmill, christi, pea
895, population, middle, low, agricultural, total
896, front, generation, available, rear, manual
897, portland, salem, closure, booth, stanton
898, voice, theme, super, dragon, hero
899, canada, canadian, toronto, ontario, sunday
900, new, jersey, lester, guernsey, tuck
901, oregon, seattle, wan, osborne, tong
902, ben, mediterranean, tunisia, mercenary, carthage
903, baby, alternative, better, worldwide, neck
904, trade, agreement, nepal, constitution, navigation
905, north, carolina, charlotte, wake, charleston
906, whole, jenny, suppose, darius, obvious
907, force, unit, base, command, air
908, nhl, stanley, ahl, manitoba, winnipeg
909, antonio, carlos, santos, referee, gonzález
910, exist, propose, limit, proposal, exit
911, philosophy, papers, philosopher, philosophical, catalog
912, east, nelson, carnegie, swansea, dalton
913, jesus, matthew, gospel, luke, christ
914, friend, tell, reveal, find, everyone
915, unknown, mask, casa, alto, eduardo
916, alfred, kate, martha, wainwright, racine
917, book, life, write, work, sas
918, nine, inch, nothing, mob, hurt
919, flight, charter, airline, airlines, airways
920, run, hour, half, minute, distance
921, shore, glen, ant, nest, drain
922, lebanon, fault, lebanese, mandate, beirut
923, cook, eat, dish, sweet, cuisine
924, leader, president, leadership, vice, resign
925, angola, namibia, stamford, sabre, cham
926, ferdinand, alfonso, león, castile, aragon
927, formation, tooth, fossil, specimen, species
928, newport, shrewsbury, shropshire, gladstone, iroquois
929, travel, citizen, permanent, visa, citizenship
930, round, michigan, lost, lose, advance
931, account, secret, secure, steal, privilege
932, main, industry, worker, schedule, shaw
933, map, ring, element, lie, category
934, township, harrison, evans, linda, beatles
935, great, crowd, panic, warrington, haynes
936, culture, cultural, idea, identity, experience
937, glass, candy, nut, butter, bead
938, festival, documentary, lang, dir, jury
939, fan, dana, benton, magnum, millwall
940, paper, potter, bryant, finn, pulp
941, night, squadron, raf, airfield, flying
942, without, situation, enough, least, failure
943, world, gold, event, silver, bronze
944, johnson, kidd, trafford, marlon, boswell
945, andrew, finch, ramsay, cochrane, neighbours
946, houston, bowl, oakland, lions, malta
947, originally, programming, morning, cancel, afternoon
948, individual, affect, intervention, increase, group
949, starr, katy, dunlop, muñoz, ringo
950, victoria, melbourne, victorian, ballarat, kilda
951, son, daughter, wife, marry, marriage
952, test, matthews, rutgers, shenzhen, erickson
953, polish, warsaw, kraków, dynamo, poles
954, original, revival, capitol, mural, garage
955, nova, scotia, halifax, float, breton
956, commission, advocate, percy, provost, downing
957, shop, baker, coffee, birthday, cake
958, scene, dream, passion, wicked, angry
959, set, sequence, domain, related, empty
960, political, favour, coalition, hale, spd
961, harbour, hurricane, bermuda, laurel, prospect
962, theory, strong, interaction, expression, specific
963, david, february, retire, gabriel, toledo
964, ground, manchester, surrey, worcester, moor
965, library, gift, teresa, collection, endowment
966, portuguese, portugal, liga, silva, lisbon
967, theatre, senate, theater, maryland, senator
968, glasgow, drum, stick, clyde, dundee
969, avon, bowman, guangdong, sichuan, yunnan
970, council, mayor, queensland, ward, borough
971, death, murder, kill, plot, suspect
972, bar, text, municipality, till, shift
973, ray, roy, bengali, publishers, bengal
974, act, law, duty, consent, clause
975, initially, begin, later, lazarus, badly
976, term, example, choose, item, choice
977, spring, membership, rough, member, geothermal
978, woman, women, nursing, gender, first
979, atlantic, fishing, preserve, idaho, northeastern
980, box, rocky, maker, cigar, set
981, afghanistan, holden, gardner, afghan, commodore
982, asia, asian, southeast, laos, lao
983, maine, exeter, concord, refinery, spill
984, kent, chronicle, sussex, saxon, fern
985, robot, toy, cannon, beast, bow
986, usa, teen, ana, costume, freeway
987, angel, vampire, demon, dawn, spell
988, merchant, scream, wax, isles, orphanage
989, different, instrument, use, mode, sometimes
990, creek, flow, stream, tunnel, log
991, method, physics, mathematics, quantum, mathematical
992, florida, ohio, illinois, wisconsin, dallas
993, port, message, send, mac, connection
994, hopkins, johns, wade, ritter, kitten
995, century, ages, part, remains, early
996, slow, emi, maiden, dickinson, gomez
997, adam, curtis, boom, pseudonym, dissertation
998, rich, emily, leslie, jamie, drake
999, late, tenure, early, tonight, carson